<?xml version="1.0" standalone="yes" ?>
<!DOCTYPE student SYSTEM "student.dtd">
<student>
<student-info>
<name gender="M"> Teja Srinivas</name>
<rollno>16</rollno>
<address>
<city pin="522019">Cowdavaram</city>
<contact-no>756542</contact-no>
</address>
</student-info>
<student-info>
<name gender="M">Harsha</name>
<rollno>62</rollno>
<address>
<city pin="522001">Mumbai</city>
<contact-no>3129</contact-no>
</address>
</student-info>
</student>